{
  "receipt_version": "2.0",
  "artifact_type": "sofrs_report_validation_receipt",
  "receipt_id": "receipt.sir-f5-learned.sofrs-v2",
  "report": {
    "report_id": "sir-f5-learned",
    "sofrs_version": "2.0",
    "record_kind": "diagnostic_analogue",
    "artifact": {
      "uri": "experiments/paper13/results/source-reports/reports/sir_f5_learned.sofreport.json",
      "digest": {
        "algorithm": "sha256",
        "value": "8afa8de039febe69cae26502e022aac642e7fe2d0bb476b6f5db8eaaf0bcb5cb"
      }
    }
  },
  "validator": {
    "validator_id": "sofrs.report-validator.v2",
    "validator_version": "2.0",
    "implementation": {
      "uri": "experiments/paper12/validation/validate_sofrs_v2.py",
      "digest": {
        "algorithm": "sha256",
        "value": "c0b39a841b592dc2173c8a3fc350a8c2096a5fb9fe1c2e443f07b88d0764d4e9"
      }
    },
    "receipt_contract": {
      "uri": "schemas/sofrs/report-validation-receipt-v2.0.schema.json",
      "digest": {
        "algorithm": "sha256",
        "value": "3268e1119185a8401ac08ff2b41745152e9a7787b75bff9e3f0ff5183e5ae672"
      }
    }
  },
  "artifact_closure": {
    "artifact_count": 7,
    "ordered_artifacts": [
      {
        "role": "report",
        "artifact": {
          "uri": "experiments/paper13/results/source-reports/reports/sir_f5_learned.sofreport.json",
          "digest": {
            "algorithm": "sha256",
            "value": "8afa8de039febe69cae26502e022aac642e7fe2d0bb476b6f5db8eaaf0bcb5cb"
          }
        }
      },
      {
        "role": "capability_manifest",
        "artifact": {
          "uri": "experiments/paper13/results/source-reports/manifests/sir_f5_learned.capabilities.json",
          "digest": {
            "algorithm": "sha256",
            "value": "8ac43d63dd8242336a5a4bf33acd33f4f4ee2b22c259e5ec924252b0a3511639"
          }
        }
      },
      {
        "role": "typed_sof_ir",
        "artifact": {
          "uri": "experiments/paper13/results/source-reports/ir/sir_f5_learned.ir.json",
          "digest": {
            "algorithm": "sha256",
            "value": "ebf9501e6fb675e2be0a8132fdb44dc58a860b0682e20bd01c12c15a504cce36"
          }
        }
      },
      {
        "role": "compiler_profile",
        "artifact": {
          "uri": "schemas/sofrs/paper12-analogue-compiler-profile-v1.0.json",
          "digest": {
            "algorithm": "sha256",
            "value": "facc293462a79d93a00ece68e42951c49e8cfe8b141147bdfd6333bbb2b430b5"
          }
        }
      },
      {
        "role": "compiler_output",
        "artifact": {
          "uri": "experiments/paper13/results/source-reports/compiler-output/sir_f5_learned.compiler-output.json",
          "digest": {
            "algorithm": "sha256",
            "value": "d5ae9e0802065dd0f3e2ffb2f73f95130f901bd205f3f7a58e5a0236ad6b75ed"
          }
        }
      },
      {
        "role": "assembly_profile",
        "artifact": {
          "uri": "schemas/sofrs/paper12-analogue-assembly-profile-v2.0.json",
          "digest": {
            "algorithm": "sha256",
            "value": "936a80b0bcc238d47739ec5bac3aabcfb422feac2fed159739342189e678aaf1"
          }
        }
      },
      {
        "role": "assembly_implementation",
        "artifact": {
          "uri": "experiments/paper12/validation/migrate_sofrs_v1_to_v2.py",
          "digest": {
            "algorithm": "sha256",
            "value": "d0905b3647dddd67c30815f4062fdd0e4266e62c7fa5cde2e72f43840cab6252"
          }
        }
      }
    ],
    "closure_digest": {
      "algorithm": "sha256",
      "value": "6dfeec106fc0e906f2b80392ca7b3ac91dfd31a9cf0139939f91acc46991dc26"
    }
  },
  "status": "PASS",
  "checks": [
    {
      "check_id": "artifact-closure",
      "status": "PASS"
    },
    {
      "check_id": "claim-compatibility",
      "status": "PASS"
    },
    {
      "check_id": "claim-external-basis-binding",
      "status": "PASS"
    },
    {
      "check_id": "compiler-output-recompilation",
      "status": "PASS"
    },
    {
      "check_id": "cutoff-provenance",
      "status": "PASS"
    },
    {
      "check_id": "record-kind-boundary",
      "status": "PASS"
    },
    {
      "check_id": "report-assembly-recomputation",
      "status": "PASS"
    },
    {
      "check_id": "schema-validation",
      "status": "PASS"
    }
  ],
  "negative_boundaries": [
    "This receipt validates the bound SOFRS v2 report and compiler-contract closure; it does not establish adapter scientific adequacy, cross-report alignment, or downstream interpretation."
  ]
}
