{
  "receipt_version": "2.0",
  "artifact_type": "sofrs_report_validation_receipt",
  "receipt_id": "receipt.moe-expert-routing.sofrs-v2",
  "report": {
    "report_id": "moe-expert-routing",
    "sofrs_version": "2.0",
    "record_kind": "diagnostic_analogue",
    "artifact": {
      "uri": "experiments/paper12/results/reports/moe.sofreport.json",
      "digest": {
        "algorithm": "sha256",
        "value": "782a8a4e4d8ed11d0079b28f2bfe5bceaba02b2171d08bd3437b43566e910007"
      }
    }
  },
  "validator": {
    "validator_id": "sofrs.report-validator.v2",
    "validator_version": "2.0",
    "implementation": {
      "uri": "experiments/paper12/validation/validate_sofrs_v2.py",
      "digest": {
        "algorithm": "sha256",
        "value": "c0b39a841b592dc2173c8a3fc350a8c2096a5fb9fe1c2e443f07b88d0764d4e9"
      }
    },
    "receipt_contract": {
      "uri": "schemas/sofrs/report-validation-receipt-v2.0.schema.json",
      "digest": {
        "algorithm": "sha256",
        "value": "3268e1119185a8401ac08ff2b41745152e9a7787b75bff9e3f0ff5183e5ae672"
      }
    }
  },
  "artifact_closure": {
    "artifact_count": 7,
    "ordered_artifacts": [
      {
        "role": "report",
        "artifact": {
          "uri": "experiments/paper12/results/reports/moe.sofreport.json",
          "digest": {
            "algorithm": "sha256",
            "value": "782a8a4e4d8ed11d0079b28f2bfe5bceaba02b2171d08bd3437b43566e910007"
          }
        }
      },
      {
        "role": "capability_manifest",
        "artifact": {
          "uri": "experiments/paper12/results/manifests/moe.capabilities.json",
          "digest": {
            "algorithm": "sha256",
            "value": "cdc8bd7939746c57772141a631c0259c287c6f5a742023ddca584dffade6fb96"
          }
        }
      },
      {
        "role": "typed_sof_ir",
        "artifact": {
          "uri": "experiments/paper12/results/ir/moe.ir.json",
          "digest": {
            "algorithm": "sha256",
            "value": "1148c7cd57a2cd99fb0ad1a2a6f544f91987336f63aa71fb56f8bd4d1fca740c"
          }
        }
      },
      {
        "role": "compiler_profile",
        "artifact": {
          "uri": "schemas/sofrs/paper12-analogue-compiler-profile-v1.0.json",
          "digest": {
            "algorithm": "sha256",
            "value": "facc293462a79d93a00ece68e42951c49e8cfe8b141147bdfd6333bbb2b430b5"
          }
        }
      },
      {
        "role": "compiler_output",
        "artifact": {
          "uri": "experiments/paper12/results/compiler-output/moe.compiler-output.json",
          "digest": {
            "algorithm": "sha256",
            "value": "0f953ed11755f052561499df6677bd645f1cb22ab17e86ad5156cb55f8c9e83c"
          }
        }
      },
      {
        "role": "assembly_profile",
        "artifact": {
          "uri": "schemas/sofrs/paper12-analogue-assembly-profile-v2.0.json",
          "digest": {
            "algorithm": "sha256",
            "value": "936a80b0bcc238d47739ec5bac3aabcfb422feac2fed159739342189e678aaf1"
          }
        }
      },
      {
        "role": "assembly_implementation",
        "artifact": {
          "uri": "experiments/paper12/validation/migrate_sofrs_v1_to_v2.py",
          "digest": {
            "algorithm": "sha256",
            "value": "d0905b3647dddd67c30815f4062fdd0e4266e62c7fa5cde2e72f43840cab6252"
          }
        }
      }
    ],
    "closure_digest": {
      "algorithm": "sha256",
      "value": "0b659b0fdf9d7f3dd24432b5b85c4c3fdddc16d84daa451744ab34fa2cd0d878"
    }
  },
  "status": "PASS",
  "checks": [
    {
      "check_id": "artifact-closure",
      "status": "PASS"
    },
    {
      "check_id": "claim-compatibility",
      "status": "PASS"
    },
    {
      "check_id": "claim-external-basis-binding",
      "status": "PASS"
    },
    {
      "check_id": "compiler-output-recompilation",
      "status": "PASS"
    },
    {
      "check_id": "cutoff-provenance",
      "status": "PASS"
    },
    {
      "check_id": "record-kind-boundary",
      "status": "PASS"
    },
    {
      "check_id": "report-assembly-recomputation",
      "status": "PASS"
    },
    {
      "check_id": "schema-validation",
      "status": "PASS"
    }
  ],
  "negative_boundaries": [
    "This receipt validates the bound SOFRS v2 report and compiler-contract closure; it does not establish adapter scientific adequacy, cross-report alignment, or downstream interpretation."
  ]
}
