{
  "receipt_version": "2.0",
  "artifact_type": "sofrs_report_validation_receipt",
  "receipt_id": "receipt.gridworld-obs22-before.sofrs-v2",
  "report": {
    "report_id": "gridworld-obs22-before",
    "sofrs_version": "2.0",
    "record_kind": "diagnostic_analogue",
    "artifact": {
      "uri": "experiments/paper13/results/source-reports/reports/gridworld_obs22_before.sofreport.json",
      "digest": {
        "algorithm": "sha256",
        "value": "5502647c983e0641478ea670c02537f94160d6a23f735998cb502888985b83c0"
      }
    }
  },
  "validator": {
    "validator_id": "sofrs.report-validator.v2",
    "validator_version": "2.0",
    "implementation": {
      "uri": "experiments/paper12/validation/validate_sofrs_v2.py",
      "digest": {
        "algorithm": "sha256",
        "value": "c0b39a841b592dc2173c8a3fc350a8c2096a5fb9fe1c2e443f07b88d0764d4e9"
      }
    },
    "receipt_contract": {
      "uri": "schemas/sofrs/report-validation-receipt-v2.0.schema.json",
      "digest": {
        "algorithm": "sha256",
        "value": "3268e1119185a8401ac08ff2b41745152e9a7787b75bff9e3f0ff5183e5ae672"
      }
    }
  },
  "artifact_closure": {
    "artifact_count": 7,
    "ordered_artifacts": [
      {
        "role": "report",
        "artifact": {
          "uri": "experiments/paper13/results/source-reports/reports/gridworld_obs22_before.sofreport.json",
          "digest": {
            "algorithm": "sha256",
            "value": "5502647c983e0641478ea670c02537f94160d6a23f735998cb502888985b83c0"
          }
        }
      },
      {
        "role": "capability_manifest",
        "artifact": {
          "uri": "experiments/paper13/results/source-reports/manifests/gridworld_obs22_before.capabilities.json",
          "digest": {
            "algorithm": "sha256",
            "value": "78b58b1af9993951ab3bc5db2d837cca3d9b8fe92976d1a7c880fc3130fe5633"
          }
        }
      },
      {
        "role": "typed_sof_ir",
        "artifact": {
          "uri": "experiments/paper13/results/source-reports/ir/gridworld_obs22_before.ir.json",
          "digest": {
            "algorithm": "sha256",
            "value": "890b810c2976937173d0b8cb5ef0aa1c07a8ed12bcfc7cd18775d0fdd58c7370"
          }
        }
      },
      {
        "role": "compiler_profile",
        "artifact": {
          "uri": "schemas/sofrs/paper12-analogue-compiler-profile-v1.0.json",
          "digest": {
            "algorithm": "sha256",
            "value": "facc293462a79d93a00ece68e42951c49e8cfe8b141147bdfd6333bbb2b430b5"
          }
        }
      },
      {
        "role": "compiler_output",
        "artifact": {
          "uri": "experiments/paper13/results/source-reports/compiler-output/gridworld_obs22_before.compiler-output.json",
          "digest": {
            "algorithm": "sha256",
            "value": "081cdab844449da7da62b04fcd873375bb35f1f6e9b017801bee7beb5f98cf01"
          }
        }
      },
      {
        "role": "assembly_profile",
        "artifact": {
          "uri": "schemas/sofrs/paper12-analogue-assembly-profile-v2.0.json",
          "digest": {
            "algorithm": "sha256",
            "value": "936a80b0bcc238d47739ec5bac3aabcfb422feac2fed159739342189e678aaf1"
          }
        }
      },
      {
        "role": "assembly_implementation",
        "artifact": {
          "uri": "experiments/paper12/validation/migrate_sofrs_v1_to_v2.py",
          "digest": {
            "algorithm": "sha256",
            "value": "d0905b3647dddd67c30815f4062fdd0e4266e62c7fa5cde2e72f43840cab6252"
          }
        }
      }
    ],
    "closure_digest": {
      "algorithm": "sha256",
      "value": "b82ce598c7495bf8129808ae680eb177daef017911e3b0340464c4c80e195f01"
    }
  },
  "status": "PASS",
  "checks": [
    {
      "check_id": "artifact-closure",
      "status": "PASS"
    },
    {
      "check_id": "claim-compatibility",
      "status": "PASS"
    },
    {
      "check_id": "claim-external-basis-binding",
      "status": "PASS"
    },
    {
      "check_id": "compiler-output-recompilation",
      "status": "PASS"
    },
    {
      "check_id": "cutoff-provenance",
      "status": "PASS"
    },
    {
      "check_id": "record-kind-boundary",
      "status": "PASS"
    },
    {
      "check_id": "report-assembly-recomputation",
      "status": "PASS"
    },
    {
      "check_id": "schema-validation",
      "status": "PASS"
    }
  ],
  "negative_boundaries": [
    "This receipt validates the bound SOFRS v2 report and compiler-contract closure; it does not establish adapter scientific adequacy, cross-report alignment, or downstream interpretation."
  ]
}
