{
  "receipt_version": "2.0",
  "artifact_type": "sofrs_report_validation_receipt",
  "receipt_id": "receipt.api-llm-meta-llama-3-1-8b-instruct.sofrs-v2",
  "report": {
    "report_id": "api-llm-meta-llama-3-1-8b-instruct",
    "sofrs_version": "2.0",
    "record_kind": "diagnostic_analogue",
    "artifact": {
      "uri": "experiments/paper12/results/reports/nvidia_llama31_8b_20260711.sofreport.json",
      "digest": {
        "algorithm": "sha256",
        "value": "3fb0f10c125a54919b0389fa2cc8a84909219e7f9002e2753520cd8ada33be25"
      }
    }
  },
  "validator": {
    "validator_id": "sofrs.report-validator.v2",
    "validator_version": "2.0",
    "implementation": {
      "uri": "experiments/paper12/validation/validate_sofrs_v2.py",
      "digest": {
        "algorithm": "sha256",
        "value": "c0b39a841b592dc2173c8a3fc350a8c2096a5fb9fe1c2e443f07b88d0764d4e9"
      }
    },
    "receipt_contract": {
      "uri": "schemas/sofrs/report-validation-receipt-v2.0.schema.json",
      "digest": {
        "algorithm": "sha256",
        "value": "3268e1119185a8401ac08ff2b41745152e9a7787b75bff9e3f0ff5183e5ae672"
      }
    }
  },
  "artifact_closure": {
    "artifact_count": 7,
    "ordered_artifacts": [
      {
        "role": "report",
        "artifact": {
          "uri": "experiments/paper12/results/reports/nvidia_llama31_8b_20260711.sofreport.json",
          "digest": {
            "algorithm": "sha256",
            "value": "3fb0f10c125a54919b0389fa2cc8a84909219e7f9002e2753520cd8ada33be25"
          }
        }
      },
      {
        "role": "capability_manifest",
        "artifact": {
          "uri": "experiments/paper12/results/manifests/nvidia_llama31_8b_20260711.capabilities.json",
          "digest": {
            "algorithm": "sha256",
            "value": "2b01e970f42be4c101bb34a203f120767ff422675aa20cb73d45ba4a9fc5ded5"
          }
        }
      },
      {
        "role": "typed_sof_ir",
        "artifact": {
          "uri": "experiments/paper12/results/ir/nvidia_llama31_8b_20260711.ir.json",
          "digest": {
            "algorithm": "sha256",
            "value": "946c6d6e4b99fdbba6af5627e00e9a45e871adea034e7ce2d97af36ca50b019e"
          }
        }
      },
      {
        "role": "compiler_profile",
        "artifact": {
          "uri": "schemas/sofrs/paper12-analogue-compiler-profile-v1.0.json",
          "digest": {
            "algorithm": "sha256",
            "value": "facc293462a79d93a00ece68e42951c49e8cfe8b141147bdfd6333bbb2b430b5"
          }
        }
      },
      {
        "role": "compiler_output",
        "artifact": {
          "uri": "experiments/paper12/results/compiler-output/nvidia_llama31_8b_20260711.compiler-output.json",
          "digest": {
            "algorithm": "sha256",
            "value": "947341873563e2c48a2fca9b0d095c4d946736b2dc9e39f8f69aee79431785b6"
          }
        }
      },
      {
        "role": "assembly_profile",
        "artifact": {
          "uri": "schemas/sofrs/paper12-analogue-assembly-profile-v2.0.json",
          "digest": {
            "algorithm": "sha256",
            "value": "936a80b0bcc238d47739ec5bac3aabcfb422feac2fed159739342189e678aaf1"
          }
        }
      },
      {
        "role": "assembly_implementation",
        "artifact": {
          "uri": "experiments/paper12/validation/migrate_sofrs_v1_to_v2.py",
          "digest": {
            "algorithm": "sha256",
            "value": "d0905b3647dddd67c30815f4062fdd0e4266e62c7fa5cde2e72f43840cab6252"
          }
        }
      }
    ],
    "closure_digest": {
      "algorithm": "sha256",
      "value": "9ed18c9ea2c75e7fee6885fe534f7c00cf9f236ba267572d7a6e44c9e243bf8d"
    }
  },
  "status": "PASS",
  "checks": [
    {
      "check_id": "artifact-closure",
      "status": "PASS"
    },
    {
      "check_id": "claim-compatibility",
      "status": "PASS"
    },
    {
      "check_id": "claim-external-basis-binding",
      "status": "PASS"
    },
    {
      "check_id": "compiler-output-recompilation",
      "status": "PASS"
    },
    {
      "check_id": "cutoff-provenance",
      "status": "PASS"
    },
    {
      "check_id": "record-kind-boundary",
      "status": "PASS"
    },
    {
      "check_id": "report-assembly-recomputation",
      "status": "PASS"
    },
    {
      "check_id": "schema-validation",
      "status": "PASS"
    }
  ],
  "negative_boundaries": [
    "This receipt validates the bound SOFRS v2 report and compiler-contract closure; it does not establish adapter scientific adequacy, cross-report alignment, or downstream interpretation."
  ]
}
